{
  "$schema": "../schema/spell.schema.json",
  "schemaVersion": 1,
  "class": "shaman",
  "className": "Shaman",
  "dataSource": "video",
  "generatedAt": "2026-09-14T10:35:55Z",
  "observedLevel": 38,
  "tabs": [
    {
      "id": "general",
      "name": "General",
      "order": 0
    },
    {
      "id": "elemental-combat",
      "name": "Elemental Combat",
      "order": 1
    },
    {
      "id": "enhancement",
      "name": "Enhancement",
      "order": 2
    },
    {
      "id": "restoration",
      "name": "Restoration",
      "order": 3
    }
  ],
  "spells": [
    {
      "id": "call-of-the-ancestors",
      "name": "Call of the Ancestors",
      "kind": "active",
      "tab": "elemental-combat",
      "icon": "crop-call-of-the-ancestors",
      "iconSource": "crop",
      "iconCrop": "data/review/spells/shaman/call-of-the-ancestors.icon.png",
      "classic": {
        "status": "new",
        "note": "no Classic Era spell called Call of the Ancestors for this class; Classic side is a baseline spell list written from memory and unverified (data/prior/classic-era/spells-baseline.json)"
      },
      "tags": ["new"],
      "source": {
        "kind": "video",
        "video": "DxtVEhjyROU",
        "t": 20015.5,
        "frame": 1200930,
        "crop": "data/review/spells/shaman/call-of-the-ancestors.png",
        "panel": "spell-list",
        "confidence": 1.0,
        "reader": "Qwen3VL-4B-Instruct-Q4_K_M",
        "readings": [
          {
            "reader": "Qwen3VL-4B-Instruct-Q4_K_M/pass1",
            "name": "Call of the Ancestors"
          },
          {
            "reader": "Qwen3VL-4B-Instruct-Q4_K_M/pass2",
            "name": "Call of the Ancestors"
          },
          {
            "reader": "codex",
            "name": "Call of the Ancestors"
          }
        ],
        "reviewed": false
      }
    },
    {
      "id": "call-of-the-elements",
      "name": "Call of the Elements",
      "kind": "active",
      "tab": "elemental-combat",
      "icon": "crop-call-of-the-elements",
      "iconSource": "crop",
      "iconCrop": "data/review/spells/shaman/call-of-the-elements.icon.png",
      "classic": {
        "status": "new",
        "note": "no Classic Era spell called Call of the Elements for this class; Classic side is a baseline spell list written from memory and unverified (data/prior/classic-era/spells-baseline.json)"
      },
      "tags": ["new"],
      "source": {
        "kind": "video",
        "video": "DxtVEhjyROU",
        "t": 20015.5,
        "frame": 1200930,
        "crop": "data/review/spells/shaman/call-of-the-elements.png",
        "panel": "spell-list",
        "confidence": 1.0,
        "reader": "Qwen3VL-4B-Instruct-Q4_K_M",
        "readings": [
          {
            "reader": "Qwen3VL-4B-Instruct-Q4_K_M/pass1",
            "name": "Call of the Elements"
          },
          {
            "reader": "Qwen3VL-4B-Instruct-Q4_K_M/pass2",
            "name": "Call of the Elements"
          },
          {
            "reader": "codex",
            "name": "Call of the Elements"
          }
        ],
        "reviewed": false
      }
    },
    {
      "id": "chain-lightning",
      "name": "Chain Lightning",
      "kind": "active",
      "tab": "elemental-combat",
      "ranksSeen": [1],
      "icon": "crop-chain-lightning",
      "iconSource": "crop",
      "iconCrop": "data/review/spells/shaman/chain-lightning.icon.png",
      "classic": {
        "status": "unknown",
        "classicName": "Chain Lightning",
        "note": "name exists in Classic Era; whether the text or the numbers changed needs the tooltip side by side. Classic side is a baseline spell list written from memory and unverified (data/prior/classic-era/spells-baseline.json)"
      },
      "source": {
        "kind": "video",
        "video": "DxtVEhjyROU",
        "t": 20015.5,
        "frame": 1200930,
        "crop": "data/review/spells/shaman/chain-lightning.png",
        "panel": "spell-list",
        "confidence": 1.0,
        "reader": "Qwen3VL-4B-Instruct-Q4_K_M",
        "readings": [
          {
            "reader": "Qwen3VL-4B-Instruct-Q4_K_M/pass1",
            "name": "Chain Lightning",
            "rank": 1
          },
          {
            "reader": "Qwen3VL-4B-Instruct-Q4_K_M/pass2",
            "name": "Chain Lightning",
            "rank": 1
          },
          {
            "reader": "codex",
            "name": "Chain Lightning",
            "rank": 1
          }
        ],
        "reviewed": false
      }
    },
    {
      "id": "earth-shock",
      "name": "Earth Shock",
      "kind": "active",
      "tab": "elemental-combat",
      "ranksSeen": [5],
      "icon": "crop-earth-shock",
      "iconSource": "crop",
      "iconCrop": "data/review/spells/shaman/earth-shock.icon.png",
      "classic": {
        "status": "unknown",
        "classicName": "Earth Shock",
        "note": "name exists in Classic Era; whether the text or the numbers changed needs the tooltip side by side. Classic side is a baseline spell list written from memory and unverified (data/prior/classic-era/spells-baseline.json)"
      },
      "source": {
        "kind": "video",
        "video": "DxtVEhjyROU",
        "t": 20015.5,
        "frame": 1200930,
        "crop": "data/review/spells/shaman/earth-shock.png",
        "panel": "spell-list",
        "confidence": 1.0,
        "reader": "Qwen3VL-4B-Instruct-Q4_K_M",
        "readings": [
          {
            "reader": "Qwen3VL-4B-Instruct-Q4_K_M/pass1",
            "name": "Earth Shock",
            "rank": 5
          },
          {
            "reader": "Qwen3VL-4B-Instruct-Q4_K_M/pass2",
            "name": "Earth Shock",
            "rank": 5
          },
          {
            "reader": "codex",
            "name": "Earth Shock",
            "rank": 5
          }
        ],
        "reviewed": false
      }
    },
    {
      "id": "earthbind-totem",
      "name": "Earthbind Totem",
      "kind": "active",
      "tab": "elemental-combat",
      "icon": "crop-earthbind-totem",
      "iconSource": "crop",
      "iconCrop": "data/review/spells/shaman/earthbind-totem.icon.png",
      "classic": {
        "status": "unknown",
        "classicName": "Earthbind Totem",
        "note": "name exists in Classic Era; whether the text or the numbers changed needs the tooltip side by side. Classic side is a baseline spell list written from memory and unverified (data/prior/classic-era/spells-baseline.json)"
      },
      "source": {
        "kind": "video",
        "video": "DxtVEhjyROU",
        "t": 20015.5,
        "frame": 1200930,
        "crop": "data/review/spells/shaman/earthbind-totem.png",
        "panel": "spell-list",
        "confidence": 1.0,
        "reader": "Qwen3VL-4B-Instruct-Q4_K_M",
        "readings": [
          {
            "reader": "Qwen3VL-4B-Instruct-Q4_K_M/pass1",
            "name": "Earthbind Totem"
          },
          {
            "reader": "Qwen3VL-4B-Instruct-Q4_K_M/pass2",
            "name": "Earthbind Totem"
          },
          {
            "reader": "codex",
            "name": "Earthbind Totem"
          }
        ],
        "reviewed": false
      }
    },
    {
      "id": "fire-nova",
      "name": "Fire Nova",
      "kind": "active",
      "tab": "elemental-combat",
      "ranksSeen": [3],
      "icon": "crop-fire-nova",
      "iconSource": "crop",
      "iconCrop": "data/review/spells/shaman/fire-nova.icon.png",
      "classic": {
        "status": "new",
        "note": "no Classic Era spell called Fire Nova for this class; Classic side is a baseline spell list written from memory and unverified (data/prior/classic-era/spells-baseline.json)"
      },
      "tags": ["new"],
      "source": {
        "kind": "video",
        "video": "DxtVEhjyROU",
        "t": 20015.5,
        "frame": 1200930,
        "crop": "data/review/spells/shaman/fire-nova.png",
        "panel": "spell-list",
        "confidence": 1.0,
        "reader": "Qwen3VL-4B-Instruct-Q4_K_M",
        "readings": [
          {
            "reader": "Qwen3VL-4B-Instruct-Q4_K_M/pass1",
            "name": "Fire Nova",
            "rank": 3
          },
          {
            "reader": "Qwen3VL-4B-Instruct-Q4_K_M/pass2",
            "name": "Fire Nova",
            "rank": 3
          },
          {
            "reader": "codex",
            "name": "Fire Nova",
            "rank": 3
          }
        ],
        "reviewed": false
      }
    },
    {
      "id": "flame-shock",
      "name": "Flame Shock",
      "kind": "active",
      "tab": "elemental-combat",
      "ranksSeen": [3],
      "icon": "crop-flame-shock",
      "iconSource": "crop",
      "iconCrop": "data/review/spells/shaman/flame-shock.icon.png",
      "tooltips": [
        {
          "cost": "160 Mana",
          "range": "20 yd range",
          "castTime": "Instant",
          "cooldown": "6 sec cooldown",
          "description": "Instantly sears the target with fire, causing 66 Fire damage immediately and 89 Fire damage over 12 sec.",
          "source": {
            "kind": "video",
            "video": "DxtVEhjyROU",
            "t": 20049.5,
            "frame": 1202970,
            "crop": "data/review/spells/shaman/flame-shock.tooltip.png",
            "panel": "tooltip",
            "confidence": 1.0,
            "reader": "Qwen3VL-4B-Instruct-Q4_K_M",
            "readings": [
              {
                "reader": "Qwen3VL-4B-Instruct-Q4_K_M/pass1",
                "name": "Flame Shock",
                "description": "Instantly sears the target with fire, causing 66 Fire damage immediately and 89 Fire damage over 12 sec."
              },
              {
                "reader": "Qwen3VL-4B-Instruct-Q4_K_M/pass2",
                "name": "Flame Shock",
                "description": "Instantly sears the target with fire, causing 66 Fire damage immediately and 89 Fire damage over 12 sec."
              },
              {